provider,ticker,title,summary,url,image,source,published_at_utc,collected_at_utc
finnhub,AMZN,Ray-Ban Meta glasses take off but face privacy and competition test,"EssilorLuxottica is betting big on smart eyewear and the gamble is about to be tested.  Its Ray-Ban Meta glasses, powered by artificial intelligence, have delivered their first meaningful revenue boost this year, but analysts warn that privacy concerns and a wave of new rivals could limit their growth.  Yet the same features that promise to make the AI-powered frames - born from the collaboration between Mark Zuckerberg's Meta and French-Italian eyewear giant EssilorLuxottica - into a must-have device are sparking concerns, as bystanders have little control over being recorded or ‌how their data is handled.",https://finnhub.io/api/news?id=213022579b86a623c4f0d5a43f8513aae5f60f0a229bdeb22fb6e96582d003f2,https://s.yimg.com/rz/stage/p/yahoo_finance_en-US_h_p_finance_2.png,Yahoo,2025-12-09T16:14:24Z,2025-12-10T16:00:18.004923+00:00
finnhub,AMZN,What Trump's Nvidia China sales approval means for the Mag 7,"President Trump announced on Monday that he has approved Nvidia (NVDA) selling H200 chips in China. Yahoo Finance Senior Reporter Ines Ferré, Siebert Financial chief investment officer Mark Malek, and Principal Asset Management chief global strategist Seema Shah join Opening Bid host Brian Sozzi to discuss the impact on Nvidia, the artificial intelligence (AI) trade, and the ""Magnificent Seven."" To watch more expert insights and analysis on the latest market action, check out more Opening Bid.",https://finnhub.io/api/news?id=e8c6a49656bc6755602a9c399ca6018ae09023db4107de6a71b43cc18375846d,https://s.yimg.com/rz/stage/p/yahoo_finance_en-US_h_p_finance_2.png,Yahoo,2025-12-09T16:00:00Z,2025-12-10T16:00:18.004923+00:00
finnhub,AMZN,Dollar Stores Top Mag-7 in 2025: Time for Value & Dividend ETFs?,"Dollar stores are crushing the Mag-7 in 2025, signaling a shift to value. Is it time to look at RPV, RSPS, FLOW, MDPL and SDY?",https://finnhub.io/api/news?id=ee33849e6c947438310cd1800767e70bda8ffa94db55145e49c6d8fdd67feea4,https://s.yimg.com/rz/stage/p/yahoo_finance_en-US_h_p_finance_2.png,Yahoo,2025-12-09T16:00:00Z,2025-12-10T16:00:18.004923+00:00
finnhub,AMZN,San Francisco Downtown Development Corporation Announces Over $60 Million in Early Contributions and Commitments to Revitalize and Reimagine Downtown,"The San Francisco Downtown Development Corporation (DDC), the nonprofit public benefit corporation working alongside civic, business, labor, and philanthropic leaders to revitalize the heart of downtown San Francisco, today announced over $60 million in contributions and commitments from philanthropic, corporate, and individual partners, including support from Google, Ripple, Thoma Bravo, Amazon, and OpenAI. This is one of the largest privately driven investments in downtown's post-pandemic reco",https://finnhub.io/api/news?id=dddce64090bcfa9b1464c3d0067064384562df2a7241051ecce21a170945ae5b,https://s.yimg.com/rz/stage/p/yahoo_finance_en-US_h_p_finance_2.png,Yahoo,2025-12-09T16:00:00Z,2025-12-10T16:00:18.004923+00:00
finnhub,AMZN,Tracking Dan Loeb's Third Point Portfolio - Q3 2025 Update,"Third Point's Q3 2025 13F reveals new SPY Puts, top holdings, and major stock shifts.",https://finnhub.io/api/news?id=163fbfdfed6472c3fd6700b5b6b9b429980388a4cdcea8f7b3af975e4504ead1,https://static.seekingalpha.com/cdn/s3/uploads/getty_images/186805810/image_186805810.jpg?io=getty-c-w1536,SeekingAlpha,2025-12-09T15:58:41Z,2025-12-10T16:00:18.004923+00:00
finnhub,AMZN,"Marvell Stock Falls on Microsoft, Amazon Fears. ‘Block Out the Noise.’",Analysts at Stifel and J.P. Morgan pushed back on reports the chip maker is losing important orders for custom chips.,https://finnhub.io/api/news?id=53998c2e4febf6f0ef766852b059842c2ea99940f0616c8f307cd57017d13187,https://s.yimg.com/rz/stage/p/yahoo_finance_en-US_h_p_finance_2.png,Yahoo,2025-12-09T15:49:00Z,2025-12-10T16:00:18.004923+00:00
finnhub,AMZN,Bezos Is Quietly Bullish on Trump Accounts and Insiders Expect a Huge Contribution,"There’s plenty of intrigue (and rightly so) around president Donald Trump’s policies. No matter whether we’re talking trade, immigration, or economic policies – doesn’t matter. This current president has rolled out a number of key changes across most areas of society and the economy that are hard to ignore. Whether you’re a fan of his ... Bezos Is Quietly Bullish on Trump Accounts and Insiders Expect a Huge Contribution",https://finnhub.io/api/news?id=bd8eb85db90ce551a123c5aeddffbd3b6084342037d9bf179181037ba0031500,https://s.yimg.com/rz/stage/p/yahoo_finance_en-US_h_p_finance_2.png,Yahoo,2025-12-09T15:23:45Z,2025-12-10T16:00:18.004923+00:00
