provider,ticker,title,summary,url,image,source,published_at_utc,collected_at_utc
finnhub,ASML,Is ASML (NasdaqGS:ASML) Overvalued After Its Strong Recent Share Price Run?,"ASML Holding (NasdaqGS:ASML) has quietly kept rewarding patient investors, with the stock up roughly 8% over the past month and almost 38% in the past 3 months as chip demand expectations improve. See our latest analysis for ASML Holding. That move sits within a much bigger upswing, with the share price returning around 57% year to date and a robust 1 year total shareholder return of roughly 56%. This suggests momentum is still building as investors lean into the semiconductor upcycle and...",https://finnhub.io/api/news?id=3b812024b5504ecd2818afb1dda6d5f51c55db8c57852d3b5181f3409ecfd765,https://s.yimg.com/rz/stage/p/yahoo_finance_en-US_h_p_finance_2.png,Yahoo,2025-12-07T22:05:05Z,2025-12-10T15:59:13.573044+00:00
finnhub,ASML,"Up 59%, Should You Buy ASML Right Now?",The manufacturer is trading at an all-time high.,https://finnhub.io/api/news?id=3ca9b04056a655b430bc53b15ef5a1199e2d737d27dbc9d53143a1dde7f8c2f6,https://s.yimg.com/rz/stage/p/yahoo_finance_en-US_h_p_finance_2.png,Yahoo,2025-12-07T01:35:00Z,2025-12-10T15:59:13.573044+00:00
finnhub,ASML,Taiwan Semiconductor Manufacturing vs. ASML: Which Stock Will Outperform in 2026?,"Both stocks should have strong 2026s, but one stands out.",https://finnhub.io/api/news?id=b92da751733ae5eae73c9c35c3d519b6d5ebf72fd33351cadfdc2d892f33f8ae,https://s.yimg.com/rz/stage/p/yahoo_finance_en-US_h_p_finance_2.png,Yahoo,2025-12-05T18:35:00Z,2025-12-10T15:59:13.573044+00:00
finnhub,ASML,Brokers Suggest Investing in ASML (ASML): Read This Before Placing a Bet,"The average brokerage recommendation (ABR) for ASML (ASML) is equivalent to a Buy. The overly optimistic recommendations of Wall Street analysts make the effectiveness of this highly sought-after metric questionable. So, is it worth buying the stock?",https://finnhub.io/api/news?id=f151ed912b7c74711314742f6767a62482b4915b24b52136bd6c178aea786ff9,https://s.yimg.com/rz/stage/p/yahoo_finance_en-US_h_p_finance_2.png,Yahoo,2025-12-05T14:30:03Z,2025-12-10T15:59:13.573044+00:00
finnhub,ASML,"With Netflix's 10-for-1 Stock Split Complete, Here Are 3 Growth Stocks to Buy in December That Could Issue Stock Splits in 2026","Surging stock prices and earnings growth potential make Meta Platforms, ASML, and Eli Lilly ripe for stock splits in the new year.",https://finnhub.io/api/news?id=fb2fc2f3bd906b2ccebce73f1de644c53dd3248cab30b29ae8eff3b33f92ec95,https://s.yimg.com/rz/stage/p/yahoo_finance_en-US_h_p_finance_2.png,Yahoo,2025-12-05T07:50:00Z,2025-12-10T15:59:13.573044+00:00
finnhub,ASML,Are You Looking for a Top Momentum Pick? Why ASML (ASML) is a Great Choice,Does ASML (ASML) have what it takes to be a top stock pick for momentum investors? Let's find out.,https://finnhub.io/api/news?id=01b1b6f7245fa8b0465cd2fce1f0de61d875e355218e93398da0a91c755b6f29,https://s.yimg.com/rz/stage/p/yahoo_finance_en-US_h_p_finance_2.png,Yahoo,2025-12-04T17:00:02Z,2025-12-10T15:59:13.573044+00:00
finnhub,ASML,Better Artificial Intelligence Stock: ASML vs. Nebius Group,"AI is driving sales growth for both companies, but one stands out as a superior investment.",https://finnhub.io/api/news?id=6a654ae02b201ebc4388122ef0d14c936fae76ea057a2d708d73d3b1b1a6be7c,https://s.yimg.com/rz/stage/p/yahoo_finance_en-US_h_p_finance_2.png,Yahoo,2025-12-04T16:20:00Z,2025-12-10T15:59:13.573044+00:00
finnhub,ASML,ASML Holding N.V. (ASML): A Bull Case Theory,"We came across a bullish thesis on ASML Holding N.V. on Rebound Capital’s Substack. In this article, we will summarize the bulls’ thesis on ASML. ASML Holding N.V.’s share was trading at $1060.00 as of November 28th. ASML’s trailing and forward P/E were 37.71 and 34.48 respectively according to Yahoo Finance. ASML Holding N.V. provides lithography solutions for […]",https://finnhub.io/api/news?id=3eaff6d79e18b4519e986065081b8a36f78ad880e8a38817a2312267e633782d,https://s.yimg.com/rz/stage/p/yahoo_finance_en-US_h_p_finance_2.png,Yahoo,2025-12-04T16:06:18Z,2025-12-10T15:59:13.573044+00:00
finnhub,ASML,Is It Too Late to Consider ASML After Its Strong 2025 Share Price Rally?,"If you are wondering whether ASML Holding is still a smart buy after its huge run, or if most of the upside is already priced in, you are not alone. The stock has climbed 5.9% over the last week, 4.0% over the past month, and is now up 39.6% year to date. This adds to an impressive 42.3% 1 year and 163.0% 5 year gain that has clearly shifted how the market views its long term potential and risk. Recent headlines have focused on ASML's central role in supplying cutting edge lithography...",https://finnhub.io/api/news?id=a60075695ff944983ba7e809486db3236a0f8576aae19b8d5b19d128877831b5,https://s.yimg.com/rz/stage/p/yahoo_finance_en-US_h_p_finance_2.png,Yahoo,2025-12-04T14:15:52Z,2025-12-10T15:59:13.573044+00:00
finnhub,ASML,Here is What to Know Beyond Why ASML Holding N.V. (ASML) is a Trending Stock,"ASML (ASML) has been one of the stocks most watched by Zacks.com users lately. So, it is worth exploring what lies ahead for the stock.",https://finnhub.io/api/news?id=8d7c2d69c1df17396a461e2370e82d8761e2eecdcd5b6f4dbb8fd3eb7a045cf5,https://s.yimg.com/rz/stage/p/yahoo_finance_en-US_h_p_finance_2.png,Yahoo,2025-12-04T14:00:06Z,2025-12-10T15:59:13.573044+00:00
finnhub,ASML,Why Analysts Say ASML Is the Top Semiconductor Pick Heading Into 2026,"ASML Holding N.V. (NASDAQ:ASML) is one of the AI Stocks in Focus This Week. On December 1, Morgan Stanley reiterated an Overweight rating on the stock with a €1,000.00 price target. The firm is optimistic on the stock driven by positive momentum for lithography demand. Analysts have labeled ASML as its Top Pick in European semiconductors […]",https://finnhub.io/api/news?id=36f17aa40a6acc7b60bf7f358ca5fa8fd6911b0c4b7f2a88bce4ae2d0739676f,https://s.yimg.com/rz/stage/p/yahoo_finance_en-US_h_p_finance_2.png,Yahoo,2025-12-04T09:53:29Z,2025-12-10T15:59:13.573044+00:00
finnhub,ASML,Huawei's 2022 patent details novel technique to make 2-nm-class chips without EUV tool,"Huawei Technologies' three-year-old patent for advanced patterning comparable with 2-nanometre grade technology without extreme ultraviolet (EUV) lithography tools has intensified speculation about a potential breakthrough in advanced chips. The US-sanctioned company is working to patent a metal integration technique for manufacturing semiconductors, which allows narrow metal structures to be integrated using deep ultraviolet (DUV) technology even for ""metal pitches below 21nm"", a feature requir",https://finnhub.io/api/news?id=609b4b3951e8aad8b0c07008da3e31df3a3009e5934b2bab364fbb47f182f2c8,https://s.yimg.com/rz/stage/p/yahoo_finance_en-US_h_p_finance_2.png,Yahoo,2025-12-04T09:30:00Z,2025-12-10T15:59:13.573044+00:00
finnhub,ASML,SCHD ETF Alternative Strategy Aimed For Higher Total Return,"Read here for a proven dividend growth stock strategy outperforming SCHD ETF. See top picks, performance data, and key metrics.",https://finnhub.io/api/news?id=c017a105b901f94983ddecbb010e4c5c7e370bb1ce5cba3a64441da8f18c95b6,https://static.seekingalpha.com/cdn/s3/uploads/getty_images/2148089915/image_2148089915.jpg?io=getty-c-w1536,SeekingAlpha,2025-12-03T23:07:54Z,2025-12-10T15:59:13.573044+00:00
finnhub,META,S&P 500: 8 'Big And Rich' Stocks With Near-Term Volatility To Exploit,Discover tactical trading strategies for top tech stocks dominating the S&P 500.,https://finnhub.io/api/news?id=e5ea3a1256a0810b57be43136b8e01e52cc75cb702e640943a990b8e9b4c042f,https://static.seekingalpha.com/cdn/s3/uploads/getty_images/1188531463/image_1188531463.jpg?io=getty-c-w1536,SeekingAlpha,2025-12-10T10:30:29Z,2025-12-10T15:59:44.932172+00:00
finnhub,META,Equinix: Powering The AI Boom With 2.5% Yield And 12% Dividend Growth,"Equinix stock is a top REIT for AI-driven data center growth with solid returns, robust bookings, and attractive valuation. Learn more.",https://finnhub.io/api/news?id=ca88d4c81c0cbb1e91f95c5e218bdd3b2de53fb95f6a7aa7d651875ec81dbfa2,https://static.seekingalpha.com/cdn/s3/uploads/getty_images/2236865789/image_2236865789.jpg?io=getty-c-w1536,SeekingAlpha,2025-12-10T08:00:00Z,2025-12-10T15:59:44.932172+00:00
finnhub,META,Meta Platforms: Still Waiting For A Breakthrough And Revaluation (Rating Upgrade),"Meta Platforms' Family of Apps segment delivers robust profitability, with net profit margin above 30% and ROIC exceeding 23%. Read why META stock is a Buy.",https://finnhub.io/api/news?id=ff0d126086fb49aafc15339ba7a89e20a0da88007c95d8a749ca9e8306e46697,https://static.seekingalpha.com/cdn/s3/uploads/getty_images/1399581176/image_1399581176.jpg?io=getty-c-w1536,SeekingAlpha,2025-12-10T03:15:34Z,2025-12-10T15:59:44.932172+00:00
finnhub,META,Memos From Howard Marks: Is It A Bubble?,,https://finnhub.io/api/news?id=a1950a9a530e88d49e7f36b420e19a600c8c5a646e26dea4e170d95e80f33545,,SeekingAlpha,2025-12-09T18:30:00Z,2025-12-10T15:59:44.932172+00:00
finnhub,META,3 Monthly-Paying Dividend ETFs Perfect for Retirement Income,"After over a decade of ultra-low yields, retirees are finding themselves much more comfortable due to Treasuries yielding sub-5% interest rates. Many investors are locking in that rate. It may be a good idea if you are someone who is very elderly, but stocks have a history of outperforming Treasuries long-term. They also protect you ... 3 Monthly-Paying Dividend ETFs Perfect for Retirement Income",https://finnhub.io/api/news?id=568ec98532389ee0e05efe21da2c719b4bd49a3a7e2486ef442b42af23fd8120,https://s.yimg.com/rz/stage/p/yahoo_finance_en-US_h_p_finance_2.png,Yahoo,2025-12-09T17:47:09Z,2025-12-10T15:59:44.932172+00:00
finnhub,META,Wall Street Firm Stays Bullish on Broadcom (AVGO) Ahead of December 11 Earnings,"Broadcom Inc. (NASDAQ:AVGO) is one of the Must-Watch AI Stocks on Wall Street. On December 5, Mizuho analyst Vijay Rakesh maintained an “Outperform” rating on the stock with a $435 price target. The firm is positive on the stock ahead of earnings as it believes Broadcom is a core AI enabler with multiple near-term and long-term […]",https://finnhub.io/api/news?id=12835218aa919cc93a1724367e910eae98ac4d5559f893835ffd1e06791e51f7,https://s.yimg.com/rz/stage/p/yahoo_finance_en-US_h_p_finance_2.png,Yahoo,2025-12-09T17:33:52Z,2025-12-10T15:59:44.932172+00:00
finnhub,META,Ray-Ban Meta Glasses Gain Momentum but Face Privacy and Competition Challenges,Early sales strength tested as regulators and rivals intensify pressure,https://finnhub.io/api/news?id=04dc6383b5d49ee3d1510c87f659e5a0e84fa7eb31c3c74feb41be11bd9c3421,https://s.yimg.com/rz/stage/p/yahoo_finance_en-US_h_p_finance_2.png,Yahoo,2025-12-09T17:33:12Z,2025-12-10T15:59:44.932172+00:00
finnhub,META,"Apple's $4 Trillion Comeback: Why It's Now Beating Nvidia, Microsoft, and Meta at Their Own Game","As the AI frenzy fades, Apple's slow-and-steady play is turning into Silicon Valley's most valuable contrarian bet.",https://finnhub.io/api/news?id=f1d984a3715204cb2342fd3d5cf2f4bdaf5139e8731b275f5534f6cee78b0cc8,https://s.yimg.com/rz/stage/p/yahoo_finance_en-US_h_p_finance_2.png,Yahoo,2025-12-09T17:15:03Z,2025-12-10T15:59:44.932172+00:00
finnhub,META,Wall Street Sees Upside for META as Metaverse Budget Faces Major Trim,"Meta Platforms, Inc. (NASDAQ:META) is one of the Must-Watch AI Stocks on Wall Street. On December 4, Mizuho analyst Lloyd Walmsley reiterated an Outperform rating on the stock with an $815.00 price target. The rating affirmation follows potential cuts to Metaverse; which signal upside for Meta and could potentially add $2/share to 2026 EPS. A Bloomberg […]",https://finnhub.io/api/news?id=808d5360a919b5cd120535cd71c2dccf3eefbf959dd74f945e4e567aeae76483,https://s.yimg.com/rz/stage/p/yahoo_finance_en-US_h_p_finance_2.png,Yahoo,2025-12-09T17:08:04Z,2025-12-10T15:59:44.932172+00:00
finnhub,META,Top Midday Stories: Nvidia H200 AI Chips' China Access; Google's EU Antitrust Probe; Amazon New York Drivers Join Teamsters Union,All three major US stock indexes were edging higher in late-morning trading on Tuesday after the Fed,https://finnhub.io/api/news?id=a3e7f50ebd9055239ec39df11c2e658f8ae2c9b9850952612c42b475ae7877b3,https://s.yimg.com/rz/stage/p/yahoo_finance_en-US_h_p_finance_2.png,Yahoo,2025-12-09T17:06:37Z,2025-12-10T15:59:44.932172+00:00
finnhub,META,Wall Street Bullish on Meta Platforms (META) Here’s Why,"Meta Platforms, Inc. (NASDAQ:META) is one of the Good Stocks to Buy According to Analysts. Wall Street is bullish on Meta Platforms, Inc. (NASDAQ:META) on December 4, Rocco Strauss from Arete Research upgraded the stock from Hold to Buy with a $718 price target. ​Earlier on December 2, Brad Erickson from RBC Capital also reiterated […]",https://finnhub.io/api/news?id=bd934c68c82ff2fa33a75d9c76fcaf320e814f079b3254febede946cf25f69e6,https://s.yimg.com/rz/stage/p/yahoo_finance_en-US_h_p_finance_2.png,Yahoo,2025-12-09T16:39:29Z,2025-12-10T15:59:44.932172+00:00
finnhub,META,Ray-Ban Meta glasses take off but face privacy and competition test,"By Elisa Anzolin and Gianluca Lo Nostro MILAN, Dec 9 (Reuters) - EssilorLuxottica is betting big on smart eyewear and the gamble is about to be tested.",https://finnhub.io/api/news?id=1bb80a2d28696833c9a7678d96a296b741e313256edce6a891028215fb80c853,https://s.yimg.com/rz/stage/p/yahoo_finance_en-US_h_p_finance_2.png,Yahoo,2025-12-09T16:19:54Z,2025-12-10T15:59:44.932172+00:00
finnhub,META,What Trump's Nvidia China sales approval means for the Mag 7,"President Trump announced on Monday that he has approved Nvidia (NVDA) selling H200 chips in China. Yahoo Finance Senior Reporter Ines Ferré, Siebert Financial chief investment officer Mark Malek, and Principal Asset Management chief global strategist Seema Shah join Opening Bid host Brian Sozzi to discuss the impact on Nvidia, the artificial intelligence (AI) trade, and the ""Magnificent Seven."" To watch more expert insights and analysis on the latest market action, check out more Opening Bid.",https://finnhub.io/api/news?id=e8c6a49656bc6755602a9c399ca6018ae09023db4107de6a71b43cc18375846d,https://s.yimg.com/rz/stage/p/yahoo_finance_en-US_h_p_finance_2.png,Yahoo,2025-12-09T16:00:00Z,2025-12-10T15:59:44.932172+00:00
finnhub,META,Tracking Dan Loeb's Third Point Portfolio - Q3 2025 Update,"Third Point's Q3 2025 13F reveals new SPY Puts, top holdings, and major stock shifts.",https://finnhub.io/api/news?id=163fbfdfed6472c3fd6700b5b6b9b429980388a4cdcea8f7b3af975e4504ead1,https://static.seekingalpha.com/cdn/s3/uploads/getty_images/186805810/image_186805810.jpg?io=getty-c-w1536,SeekingAlpha,2025-12-09T15:58:41Z,2025-12-10T15:59:44.932172+00:00
finnhub,META,Pinterest Down 14.7% in a Year: Should You Avoid the Stock?,"PINS faces falling ad prices, slowing regional growth and weaker estimates as macro and competitive pressures weigh on its outlook.",https://finnhub.io/api/news?id=fdda99ca54cdc9ed7a8dceca49dd94705efe6fc4c7ca7ce93dc47ec4ef3a4504,https://s.yimg.com/rz/stage/p/yahoo_finance_en-US_h_p_finance_2.png,Yahoo,2025-12-09T15:46:00Z,2025-12-10T15:59:44.932172+00:00
finnhub,META,"'It Feels Like The World Just Changed, Again' Salesforce CEO Says Google's Gemini 3 Is 'Sharper And Faster' Than ChatGPT","SalesForce (NYSE:CRM) CEO Marc Benioff says he won't use ChatGPT again after trying Google Gemini 3 ""I've used ChatGPT every day for 3 years,"" Benioff said in a Nov. 23 post on X. ""Just spent 2 hours on Gemini 3. I'm not going back."" Google's AI model is ""sharper and faster"" than ChatGPT when it comes to ""reasoning, speed, images, video,"" he said, adding that, ""It feels like the world just changed, again."" Don't Miss: The AI Marketing Platform Backed by Insiders from Google, Meta, and Amazon — I",https://finnhub.io/api/news?id=cbc969ef12a9268d5d857723fdcbaf351ce9d0129a72b3ebe5c3084da7ccda63,https://s.yimg.com/rz/stage/p/yahoo_finance_en-US_h_p_finance_2.png,Yahoo,2025-12-09T15:16:13Z,2025-12-10T15:59:44.932172+00:00
finnhub,META,2M Raised in 100 Days: Seoul Beauty Club Rides K-Beauty Export Surge to the U.S.,"LA-to-Seoul startup, founded by ex-Apple and ex-Kim & Chang talent, raises $2 million within 100 days of beta launch by reinventing how Korean skincare reaches women 30+ LOS ANGELES, CALIFORNIA / ACCESS Newswire / December 9, 2025 / Seoul Beauty Club(SBC), ...",https://finnhub.io/api/news?id=cbd118f92a0561cac9c474cf3bc93e186e4260c94289f1d8992525e101bc7be7,https://s.yimg.com/rz/stage/p/yahoo_finance_en-US_h_p_finance_2.png,Yahoo,2025-12-09T15:00:00Z,2025-12-10T15:59:44.932172+00:00
finnhub,META,7 Surprising Stocks Warren Buffett Refuses To Own — and Why,Discover seven surprising stocks Warren Buffett refuses to own and learn the reasons behind his decisions to avoid these investments.,https://finnhub.io/api/news?id=4d26af33280ef2d0fc3d6df0109aa39d1e08d60f447eb65640100b5ba5f4c2c7,https://s.yimg.com/rz/stage/p/yahoo_finance_en-US_h_p_finance_2.png,Yahoo,2025-12-09T14:56:03Z,2025-12-10T15:59:44.932172+00:00
finnhub,META,Australia Just Banned Teens from Social Media--And Reddit's Next Move Could Be a Game-Changer,Global platforms scramble as under-16s vanish from Instagram and TikTok--investors eye the next youth migration wave.,https://finnhub.io/api/news?id=40769bd96915054f259d22f4eac43420db912f7a11a0ad83c80c8546be4b24ad,https://s.yimg.com/rz/stage/p/yahoo_finance_en-US_h_p_finance_2.png,Yahoo,2025-12-09T14:34:47Z,2025-12-10T15:59:44.932172+00:00
finnhub,META,"Stock Market News for Dec 9, 2025","Wall Street closed lower on Monday, pulled down by communication and consumer stocks.",https://finnhub.io/api/news?id=35a2065c526d98305329cb3af321f38512e1c09afa2e3abdf46ee7321237d713,https://s.yimg.com/rz/stage/p/yahoo_finance_en-US_h_p_finance_2.png,Yahoo,2025-12-09T14:28:00Z,2025-12-10T15:59:44.932172+00:00
finnhub,AMZN,S&P 500: 8 'Big And Rich' Stocks With Near-Term Volatility To Exploit,Discover tactical trading strategies for top tech stocks dominating the S&P 500.,https://finnhub.io/api/news?id=e5ea3a1256a0810b57be43136b8e01e52cc75cb702e640943a990b8e9b4c042f,https://static.seekingalpha.com/cdn/s3/uploads/getty_images/1188531463/image_1188531463.jpg?io=getty-c-w1536,SeekingAlpha,2025-12-10T10:30:29Z,2025-12-10T16:00:18.004298+00:00
finnhub,AMZN,Amazon Is The Next Mega Cap To Move,"Amazon is positioned to outperform mega-cap peers, driven by its expansive data center footprint and AI infrastructure leadership. Read why AMZN stock is a Buy.",https://finnhub.io/api/news?id=a320aa4e71275e3fc512ae9863e726a655a03be0fc4155b9a1a55ef50688f10e,https://static.seekingalpha.com/cdn/s3/uploads/getty_images/1317474419/image_1317474419.jpg?io=getty-c-w1536,SeekingAlpha,2025-12-10T01:31:48Z,2025-12-10T16:00:18.004298+00:00
finnhub,AMZN,Oracle's OpenAI reliance faces scrutiny as debt-fueled AI buildout raises worries,"Months after Oracle's $400 billion-plus contract backlog ignited a stock-market frenzy, the enthusiasm has given way to doubts about its reliance on OpenAI and debt-fueled datacenter buildout, which will dominate its earnings on Wednesday.  A smaller player ​in the cloud market for a long time, Oracle this year staked claim as one of the bigger providers of the rented ‌computing power essential for generative AI thanks to its tie-up with ChatGPT-creator OpenAI.  It is vying with industry giants Amazon.com, Microsoft and Google for a piece of the lucrative market ‌as companies adopt AI and startups developing the technology rush to secure access to capacity.",https://finnhub.io/api/news?id=4122d6c027141530bdd5b80e948b95181a807f1b795b8fb62223adf4ca6d3fb0,https://s.yimg.com/rz/stage/p/yahoo_finance_en-US_h_p_finance_2.png,Yahoo,2025-12-09T18:35:20Z,2025-12-10T16:00:18.004298+00:00
finnhub,AMZN,"MSFT: Microsoft Unveils $23 Billion AI Investment Plan to Challenge Amazon, Google","Microsoft Bets Big on AI: $23 Billion Injection Across India, Canada, UAE, and Portugal",https://finnhub.io/api/news?id=a9d2b74ed0e573e262ad8e685fff37e027082975a8cea90bc114a7d0819379fc,https://s.yimg.com/rz/stage/p/yahoo_finance_en-US_h_p_finance_2.png,Yahoo,2025-12-09T17:15:40Z,2025-12-10T16:00:18.004298+00:00
finnhub,AMZN,Top Midday Stories: Nvidia H200 AI Chips' China Access; Google's EU Antitrust Probe; Amazon New York Drivers Join Teamsters Union,All three major US stock indexes were edging higher in late-morning trading on Tuesday after the Fed,https://finnhub.io/api/news?id=a3e7f50ebd9055239ec39df11c2e658f8ae2c9b9850952612c42b475ae7877b3,https://s.yimg.com/rz/stage/p/yahoo_finance_en-US_h_p_finance_2.png,Yahoo,2025-12-09T17:06:37Z,2025-12-10T16:00:18.004298+00:00
finnhub,AMZN,Will Customer Defections Crumble Marvell Technology’s AI Empire?,"Marvell Technology‘s (NASDAQ:MRVL) stock tumbled 7% yesterday, erasing recent gains on increasing investor jitters about its position in the artificial intelligence (AI) chip sector. What caused the decline was a downgrade from Benchmark analyst Cody Acree, who shifted his rating on Marvell stock from buy to hold, citing his “high conviction” that the chip designer ... Will Customer Defections Crumble Marvell Technology’s AI Empire?",https://finnhub.io/api/news?id=fd48ac58664d29c3690fbed7929107738de987ccdf9930b3bc8b2f0bd21a91b9,https://s.yimg.com/rz/stage/p/yahoo_finance_en-US_h_p_finance_2.png,Yahoo,2025-12-09T16:51:23Z,2025-12-10T16:00:18.004298+00:00
finnhub,AMZN,Why KeyBanc Remains Bullish on Amazon (AMZN) After AWS re:Invent,"Amazon.com, Inc. (NASDAQ:AMZN) is one of the Must-Watch AI Stocks on Wall Street. On December 5, KeyBanc analyst Justin Patterson reiterated an “Overweight” rating on the stock with a $303.00 price target. The rating affirmation reflects firm optimism post AWS re:Invent, with analysts signaling confidence in AWS momentum and long-term AI growth. KeyBanc is particularly encouraged […]",https://finnhub.io/api/news?id=0d5885809cad7b8c076bc726719e72a5d765c0165863f73ef4b041a6a4605a9f,https://s.yimg.com/rz/stage/p/yahoo_finance_en-US_h_p_finance_2.png,Yahoo,2025-12-09T16:49:07Z,2025-12-10T16:00:18.004298+00:00
finnhub,AMZN,Reply achieves the AWS Agentic AI Specialization and is named an Implementation Partner for Amazon Bedrock AgentCore,"Reply achieves the AWS Agentic AI Specialization and is named an Implementation Partner for Amazon Bedrock AgentCore Reply achieves the AWS Agentic AI Specialization and is named an Implementation Partner for Amazon Bedrock AgentCore TURIN, Italy, Dec. 09, 2025 (GLOBE NEWSWIRE) -- Reply [EXM, STAR: REY] announced that it has achieved the AWS Agentic AI Specialization, a new category within the AWS AI Competency. This recognition positions Reply and its companies specialized in AWS technologies -",https://finnhub.io/api/news?id=0c129cae5a5c7bfd3af6220ba4a38c4eb5f8f2a70f96215ca883ac24677a7367,https://s.yimg.com/rz/stage/p/yahoo_finance_en-US_h_p_finance_2.png,Yahoo,2025-12-09T16:40:00Z,2025-12-10T16:00:18.004298+00:00
finnhub,AMZN,"Wall Street Bullish on NVIDIA Corporation (NVDA), Amidst New Partnerships","​NVIDIA Corporation (NASDAQ:NVDA) is one of the Good Stocks to Buy According to Analysts. On December 3, NVIDIA Corporation (NASDAQ:NVDA) was reiterated with a Buy rating and a $275 price target by Vivek Arya of Bank of America Securities. Earlier on December 1, Joseph Moore from Morgan Stanley also reiterated a Buy rating on the […]",https://finnhub.io/api/news?id=2e5ef793887adb139c2c5d7343af4eabd0527cf22269f02f8f4ef7d46480c026,https://s.yimg.com/rz/stage/p/yahoo_finance_en-US_h_p_finance_2.png,Yahoo,2025-12-09T16:39:39Z,2025-12-10T16:00:18.004298+00:00
finnhub,AMZN,Can Microsoft Stock Sustain Its AI Infrastructure Investment Pace?,"MSFT's soaring AI infrastructure spend, up 74% to $34.9B, raises fresh questions over how long the company can maintain its aggressive expansion pace.",https://finnhub.io/api/news?id=92333abdb7c0f2a6a0b569c5fb6ba161c47d4ad011b89e0619f1df9ff057d81d,https://s.yimg.com/rz/stage/p/yahoo_finance_en-US_h_p_finance_2.png,Yahoo,2025-12-09T16:30:00Z,2025-12-10T16:00:18.004923+00:00
finnhub,AMZN,3 Stocks That Could Skyrocket Before the End of 2025,All of these stocks have near-term catalysts as well as long-term opportunities.,https://finnhub.io/api/news?id=f4173293265e6d035c84c5ca746e621bd26032b34421d70d38988c84f25226c4,https://s.yimg.com/rz/stage/p/yahoo_finance_en-US_h_p_finance_2.png,Yahoo,2025-12-09T16:25:00Z,2025-12-10T16:00:18.004923+00:00
finnhub,AMZN,Microsoft to invest $17.5B in India by 2029 as AI race accelerates,The latest is Microsoft's largest investment in Asia.,https://finnhub.io/api/news?id=2deae1377db763233d51dc00d5c348df90dbbcd7332cc90891257cbaa659d888,https://s.yimg.com/rz/stage/p/yahoo_finance_en-US_h_p_finance_2.png,Yahoo,2025-12-09T16:20:12Z,2025-12-10T16:00:18.004923+00:00
finnhub,AMZN,Rubrik Launches Agent Cloud for Amazon Bedrock AgentCore to Enhance AI Agent Governance Across Multi-Cloud,"Rubrik Inc. (NYSE:RBRK) is one of the best new tech stocks to buy right now. On December 1, Rubrik announced Rubrik Agent Cloud for Amazon Bedrock AgentCore. The new integration allows Amazon Bedrock AgentCore customers to easily enable monitoring, governance, and remediation for AI agents deployed across multi-cloud resources and infrastructure. The service is built […]",https://finnhub.io/api/news?id=27f56d802e67bae93f19a28090a4e4499cd20d4fced39b98012a0ab1b54ef3e2,https://s.yimg.com/rz/stage/p/yahoo_finance_en-US_h_p_finance_2.png,Yahoo,2025-12-09T16:19:20Z,2025-12-10T16:00:18.004923+00:00
